{
  "$schema": "https://json-schema.org/draft/2020-12/schema",
  "$id": "https://mozilla-ai.github.io/cq/schema/knowledge_unit.json",
  "title": "KnowledgeUnit",
  "description": "A single unit of shared agent knowledge.",
  "type": "object",
  "required": ["id", "domains", "insight"],
  "properties": {
    "id": {
      "type": "string",
      "pattern": "^ku_[0-9a-f]{32}$",
      "description": "Prefixed UUID: ku_<hex>."
    },
    "version": {
      "type": "integer",
      "minimum": 1,
      "default": 1,
      "description": "Schema version; server assumes 1 when unset."
    },
    "domains": {
      "type": "array",
      "items": { "type": "string", "maxLength": 64 },
      "minItems": 1,
      "maxItems": 16,
      "description": "At least one domain is required."
    },
    "insight": { "$ref": "#/$defs/Insight" },
    "context": { "$ref": "#/$defs/Context" },
    "evidence": { "$ref": "#/$defs/Evidence" },
    "tier": { "$ref": "#/$defs/Tier" },
    "created_by": {
      "type": "string",
      "maxLength": 256,
      "description": "Identifier of the agent or user that created this unit."
    },
    "superseded_by": {
      "type": "string",
      "pattern": "^ku_[0-9a-f]{32}$",
      "description": "ID of the replacing knowledge unit, if any."
    },
    "extensions": { "$ref": "#/$defs/Extensions" },
    "flags": {
      "type": "array",
      "items": { "$ref": "#/$defs/Flag" },
      "default": []
    }
  },
  "additionalProperties": false,
  "$defs": {
    "Extensions": {
      "type": "object",
      "description": "Implementation-specific fields. Not portable across implementations; consumers MUST ignore unknown keys and MUST NOT rely on their presence. Keys MUST use namespace:key format with a lowercase implementation slug. Producers SHOULD only include keys they have actually set, and SHOULD NOT emit a key with a null or empty placeholder to represent an absent value, so that key-presence within a namespace is meaningful. This recommendation applies to producers and does not weaken the consumer-side rule above.",
      "patternProperties": {
        "^[a-z0-9][a-z0-9_-]*:\\S+$": true
      },
      "additionalProperties": false,
      "maxProperties": 20
    },
    "Tier": {
      "type": "string",
      "enum": ["local", "private", "public"],
      "description": "Storage tier for a knowledge unit."
    },
    "FlagReason": {
      "type": "string",
      "enum": ["stale", "incorrect", "duplicate"],
      "description": "Reason for flagging a knowledge unit."
    },
    "Flag": {
      "type": "object",
      "description": "A recorded flag against a knowledge unit.",
      "required": ["reason"],
      "properties": {
        "reason": { "$ref": "#/$defs/FlagReason" },
        "timestamp": {
          "type": "string",
          "format": "date-time"
        },
        "detail": {
          "type": "string",
          "maxLength": 1000,
          "description": "Optional explanation when flagging. Server-side only; never returned to querying agents."
        },
        "duplicate_of": {
          "type": "string",
          "pattern": "^ku_[0-9a-f]{32}$",
          "description": "ID of the knowledge unit this duplicates. Required when reason is duplicate."
        }
      },
      "additionalProperties": false,
      "if": {
        "properties": {
          "reason": { "const": "duplicate" }
        }
      },
      "then": {
        "required": ["duplicate_of"]
      }
    },
    "Insight": {
      "type": "object",
      "description": "Tripartite insight: what happened, why it matters, what to do.",
      "required": ["summary", "detail", "action"],
      "properties": {
        "summary": {
          "type": "string",
          "maxLength": 500,
          "description": "What happened."
        },
        "detail": {
          "type": "string",
          "maxLength": 8000,
          "description": "Why it matters."
        },
        "action": {
          "type": "string",
          "maxLength": 2000,
          "description": "What to do."
        }
      },
      "additionalProperties": false
    },
    "Context": {
      "type": "object",
      "description": "Language, framework, and pattern context.",
      "properties": {
        "languages": {
          "type": "array",
          "items": { "type": "string", "maxLength": 64 },
          "maxItems": 16
        },
        "frameworks": {
          "type": "array",
          "items": { "type": "string", "maxLength": 64 },
          "maxItems": 16
        },
        "pattern": {
          "type": "string",
          "maxLength": 200
        }
      },
      "additionalProperties": false
    },
    "Evidence": {
      "type": "object",
      "description": "Confidence and confirmation metrics.",
      "properties": {
        "confidence": {
          "type": "number",
          "minimum": 0.0,
          "maximum": 1.0,
          "default": 0.5,
          "description": "Confidence score; server assumes 0.5 when unset."
        },
        "confirmations": {
          "type": "integer",
          "minimum": 0,
          "default": 1,
          "description": "Confirmation count; server assumes 1 when unset."
        },
        "first_observed": {
          "type": "string",
          "format": "date-time"
        },
        "last_confirmed": {
          "type": "string",
          "format": "date-time"
        }
      },
      "additionalProperties": false
    }
  }
}
